{
  "task_id": "MODEL-12",
  "title": "Michigan Target-Blind Seed Intake and Frozen Scoring",
  "capability_owner": "MODEL: Customer-Fit Proxy Decisions & Acceptance",
  "authority_source": "Master Control Room authorized MODEL-12 Michigan Target-Blind Seed Intake and Frozen Scoring",
  "state": "COMPLETED_AWAITING_ACCEPTANCE",
  "scope": [
    "Ingest the complete authorized Michigan seed evidence through an explicit target-blind allowlisted projection and account for every source observation without reading target-body values",
    "Resolve repeated Michigan observations to physical locations using the exact accepted MODEL-10 and MODEL-04 target-blind identity methodology with ambiguity quarantined",
    "Construct the exact accepted DATA-04 and GEO-05 public spatial and multivariate evidence required by the frozen MODEL-11 preferred formulation",
    "Apply the exact accepted protected MODEL-11 final scoring state without refitting tuning feature selection recalibration or target access",
    "Materialize immutable protected Michigan identity public-feature and frozen-scoring packages with deterministic rerun verification and explicit noncomputability lineage",
    "Provide a reusable protected-local scorer for arbitrary Michigan opaque anchor latitude and longitude inputs",
    "Freeze repository-safe target-blind rules for a later separately authorized Michigan transport evaluation"
  ],
  "exclusions": [
    "No Michigan target-body value access parsing materialization logging hashing comparison sorting ranking summary validation or other use",
    "No model refit retraining retuning architecture selection feature selection coefficient intercept scaling transformation radius or missingness change",
    "No new public source vintage geography state market inventory demographic variable protected-characteristic feature or unsupported out-of-state or Canadian demographic support",
    "No silent observation or location drop imputation zero fill neutralization score manufacture or ambiguity guess",
    "No protected source path filename workbook structure row identity coordinate market lineage feature vector score model parameter handle run identity or reconstructable protected detail in Git GitHub CI or repository-safe reports",
    "No Michigan transport evaluation independent-validation conclusion production-readiness conclusion operational Demand Heat authority or proprietary-model-equivalence claim",
    "No web app API Power BI Site Scanner cloud infrastructure public service deployment acceptance record self-acceptance merge PIPE target binding or follow-on task"
  ],
  "accepted_input_artifacts": [
    "DATA04_MICHIGAN_PUBLIC_DATA_PARITY_SOURCE_CONTRACT_V1",
    "DATA04_TIGER2024_MI_TRACT_SOURCE_MANIFEST_V1",
    "GEO05_MICHIGAN_STATEWIDE_SPATIAL_SUPPORT_SPEC_V1",
    "MODEL10_WISCONSIN_COHORT_IDENTITY_LINEAGE_CONTRACT_V1",
    "MODEL11_WISCONSIN_MULTIVARIATE_MODEL_CONTRACT_V1"
  ],
  "protected_dependency_logical_ids": [
    "PROTECTED_MICHIGAN_AGGREGATED_SEED_EVIDENCE_V1",
    "PROTECTED_DATA04_MICHIGAN_PUBLIC_MATERIALIZATION_V1",
    "PROTECTED_GEO05_MICHIGAN_STATEWIDE_SPATIAL_SUPPORT_PACKAGE_V1",
    "PROTECTED_MODEL11_FINAL_SCORING_STATE_V1",
    "PROTECTED_MODEL12_OUTPUT_ROOT_V1"
  ],
  "implementation_branch": "task/model-12-michigan-target-blind-seed-intake-frozen-scoring",
  "completion_state": {
    "execution": "COMPLETED",
    "implementation_evidence": [
      "LOCAL_COMMIT",
      "TEST_PASS",
      "COMPLETION_REPORT",
      "FUTURE_PULL_REQUEST"
    ],
    "capability_acceptance": "NOT_REVIEWED"
  },
  "acceptance_destination": "MODEL: Customer-Fit Proxy Decisions & Acceptance",
  "exact_next_destination": "MODEL: Customer-Fit Proxy Decisions & Acceptance"
}
