{
  "task_id": "MODEL-11",
  "title": "Multivariate Wisconsin Customer-Fit Model Development",
  "capability_owner": "MODEL: Customer-Fit Proxy Decisions & Acceptance",
  "authority_source": "Master Control Room authorized MODEL-11 Multivariate Wisconsin Customer-Fit Model Development",
  "state": "COMPLETED_AWAITING_ACCEPTANCE",
  "scope": [
    "Freeze target-blind five-mile MODEL-11 feature construction from the accepted DATA-03 thirteen-measure menu before target-conditioned comparison",
    "Reuse the exact accepted MODEL-10 and PIPE-04 63-observation 41-physical-location Wisconsin development cohort and Isolated Sales target",
    "Compare the locked MODEL-09 spatial-concentration reference with one ridge and one elastic-net multivariate challenger under nested physical-location-grouped development diagnostics",
    "Apply the fixed material-improvement gate and either select one successor experimental formulation or retain MODEL-09",
    "Materialize immutable protected feature-freeze and development artifacts outside Git and publish only disclosure-safe aggregate development evidence"
  ],
  "exclusions": [
    "No Impacted Sales Michigan Detroit non-Wisconsin target quarantined MODEL-10 observation or unrelated protected-field access",
    "No change to accepted MODEL-09 MODEL-10 PIPE-04 DATA-03 GEO identity cohort geography source or historical evidence",
    "No protected characteristic direct proxy commercial source new ACS vintage radius proliferation market predictor or vintage predictor",
    "No independent validation market-transport production operational Demand Heat or proprietary-model-equivalence authority",
    "No protected targets identities coordinates observation features fold assignments coefficients hyperparameters predictions residuals paths handles hashes or reconstructable artifacts in Git or GitHub",
    "No acceptance record merge deployment Power BI Site Scanner or follow-on task"
  ],
  "accepted_input_artifacts": [
    "MODEL09_WISCONSIN_EXPERIMENTAL_MODEL_CONTRACT_V1",
    "DATA03_WISCONSIN_MULTIVARIATE_ACS_FEATURE_SOURCE_CONTRACT_V1",
    "MODEL10_WISCONSIN_COHORT_IDENTITY_LINEAGE_CONTRACT_V1",
    "PIPE04_MODEL10_WISCONSIN_DEVELOPMENT_BINDING_CONTRACT_V1"
  ],
  "protected_dependency_logical_ids": [
    "PROTECTED_MODEL10_WISCONSIN_COHORT_IDENTITY_LINEAGE_PACKAGE_V1",
    "PROTECTED_PIPE04_MODEL10_WISCONSIN_DEVELOPMENT_BINDING_V1",
    "PROTECTED_MODEL09_OUTPUT_ROOT_V1",
    "PROTECTED_MODEL11_OUTPUT_ROOT_V1"
  ],
  "implementation_branch": "task/model-11-multivariate-wisconsin-customer-fit-model-development",
  "completion_state": {
    "execution": "COMPLETED",
    "implementation_evidence": [
      "LOCAL_COMMIT",
      "TEST_PASS",
      "COMPLETION_REPORT",
      "FUTURE_PULL_REQUEST"
    ],
    "capability_acceptance": "NOT_REVIEWED"
  },
  "acceptance_destination": "MODEL: Customer-Fit Proxy Decisions & Acceptance",
  "exact_next_destination": "MODEL: Customer-Fit Proxy Decisions & Acceptance"
}
