{
  "task_id": "MODEL-13",
  "title": "Michigan Benchmark, Wisconsin+Michigan Successor Development, and Statewide Scoring",
  "capability_owner": "MODEL: Customer-Fit Proxy Decisions & Acceptance",
  "authority_source": "Master Control Room authorized MODEL-13 Michigan Benchmark, Wisconsin+Michigan Successor Development, and Statewide Scoring",
  "state": "IN_PROGRESS",
  "scope": [
    "Evaluate the immutable accepted MODEL-12 Michigan predictions exactly once against accepted PIPE-05 Isolated Sales at one mean pair per eligible physical location and READY the clean pre-Michigan benchmark before development consumption",
    "Freeze complete-cohort target-blind successor feature eligibility from accepted Wisconsin and Michigan public evidence before pooled target-conditioned comparison",
    "Develop and select one bounded interpretable pooled Wisconsin plus Michigan regularized-linear successor under deterministic state-balanced physical-location-grouped validation",
    "Refit the selected successor once on all eligible pooled development evidence and preserve household opportunity customer fit proxy and modeled target mass as distinct concepts",
    "Score all 3017 accepted Michigan tracts at their 2024 TIGER internal points and create stable protected-local Power-BI-ready tract and seed-context CSV outputs",
    "Verify an independent immutable rerun for semantic equality and publish only nondisclosing aggregate execution evidence"
  ],
  "exclusions": [
    "No Impacted Sales other outcome field quarantined target unrelated protected evidence site-specific Sprouts score other forecast output or cross-state identity merge",
    "No change or regeneration of accepted MODEL-12 identity cohort features coefficients predictions radii missingness support treatment grouping metrics or exclusions before the frozen benchmark is READY",
    "No new source feature family protected-characteristic feature imputation row drop market state or vintage predictor target-correlation screen arbitrary subset search black-box model or unbounded tuning",
    "No unsupported Ohio Indiana Canadian or other out-of-state demographics and no silent support-truncation correction",
    "No protected path handle registry package digest nonce identity coordinate target tract score coefficient prediction residual or reconstructable lineage in Git GitHub or disclosure-safe reports",
    "No Power BI implementation production operational Demand Heat authority proprietary-model-equivalence claim acceptance record self-acceptance merge deployment or follow-on task"
  ],
  "accepted_input_artifacts": [
    "MODEL10_WISCONSIN_COHORT_IDENTITY_LINEAGE_CONTRACT_V1",
    "PIPE04_MODEL10_WISCONSIN_DEVELOPMENT_BINDING_CONTRACT_V1",
    "MODEL11_WISCONSIN_MULTIVARIATE_MODEL_CONTRACT_V1",
    "MODEL12_MICHIGAN_TARGET_BLIND_FROZEN_SCORING_CONTRACT_V1",
    "PIPE05_MICHIGAN_ISOLATED_SALES_BINDING_CONTRACT_V1",
    "DATA03_WISCONSIN_MULTIVARIATE_ACS_FEATURE_SOURCE_CONTRACT_V1",
    "DATA04_MICHIGAN_PUBLIC_DATA_PARITY_SOURCE_CONTRACT_V1",
    "GEO05_MICHIGAN_STATEWIDE_SPATIAL_SUPPORT_SPEC_V1"
  ],
  "protected_dependency_logical_ids": [
    "PROTECTED_MODEL11_TARGET_BLIND_FEATURE_FREEZE_PACKAGE_V1",
    "PROTECTED_MODEL11_WISCONSIN_MULTIVARIATE_DEVELOPMENT_PACKAGE_V1",
    "PROTECTED_PIPE04_MODEL10_WISCONSIN_DEVELOPMENT_BINDING_V1",
    "PROTECTED_MODEL12_MICHIGAN_PHYSICAL_LOCATION_IDENTITY_PACKAGE_V1",
    "PROTECTED_MODEL12_MICHIGAN_PUBLIC_FEATURE_PACKAGE_V1",
    "PROTECTED_MODEL12_MICHIGAN_FROZEN_SCORING_PACKAGE_V1",
    "PROTECTED_PIPE05_MODEL12_MICHIGAN_ISOLATED_SALES_BINDING_V1",
    "PROTECTED_DATA04_MICHIGAN_PUBLIC_MATERIALIZATION_V1",
    "PROTECTED_GEO05_MICHIGAN_STATEWIDE_SPATIAL_SUPPORT_PACKAGE_V1",
    "PROTECTED_MODEL13_OUTPUT_ROOT_V1"
  ],
  "implementation_branch": "task/model-13-michigan-benchmark-pooled-successor-statewide-scoring",
  "completion_state": {
    "execution": "IN_PROGRESS",
    "implementation_evidence": [
      "FUTURE_PULL_REQUEST"
    ],
    "capability_acceptance": "NOT_REVIEWED"
  },
  "acceptance_destination": "MODEL: Customer-Fit Proxy Decisions & Acceptance",
  "exact_next_destination": "MODEL: Customer-Fit Proxy Decisions & Acceptance"
}
